Community,Average_Risk,Members,Num_Members
11,0.125,"ERIC HARRIS, SCOTT BROWN, TODD DOYLE, GUO XIAO HONG, STEVEN CRUZ, MATTHEW JOSEPH, ERMIL VILENOVICH VLASOV, KIMBERLY ARNOLD",8
5,0.1,"NATHAN CARTER, POPOV NIFONT EVSEEVICH, AMANDA JOHNSON, AYESHA SARMA, LOUISE VACHON-HAMEL, SUSAN RODRIGUEZ, DR.TEJAS BATRA, APRIL HORTON, YUVRAJ  BHARGAVA, CAROLINE DALLAIRE",10
64,0.05555555555555555,"DONALD DUNN, ARCELIA VIGIL, DAVID TREMBLAY, GORDON MILLER, CHERYL LUNA, CHARLOTTE LECLERC, SANA JAGGI, PAULETTE BEAUCHAMP, WANG WEN, TYLER BAILEY, GARRETT GEORGE, MARCEL CÔTÉ, SIERRA MCDOWELL, SEAN PAUL, WANG LONG, JAMES NASH, KELLY ROBERTS, JEFFREY LANG, DR.VINCENT SWEENEY, CHRISTOPHER LOGAN, PAULINE LALONDE, ROBERT GREEN, KENNETH BROCK, CHAD HARVEY, KYLE WRIGHT, GENEVIÈVE PELLETIER, MAUDE NADEAU, LUKINA ELEONORA MAKSIMOVNA, ÉLISABETH-LAURIE RAYMOND, DIANA ALLEN, ANTONINA AFANAS'EVNA NEKRASOVA, PARI DALAL, ALEXANDRA MARCOTTE, JOHNNY SANCHEZ, ÉTIENNE VÉZINA, LISA GRAHAM, MRS. VICTORIA STEWART MD, JOHN LINDSEY, ALLEN GRIFFIN, KELLY MARTIN, DR.WEI YANG, ROBERT BRYAN, AUSTIN OWENS, REBECCA FREEMAN, SUSAN HARTMAN, WHITNEY WALTON, UVAROV VIKTOR VIKENT'EVICH, PATRICIA WILLIAMS, SAMIHA MANE, CHRISTINE WELLS, LUCAS THERRIEN, AARNA KRISHNA, KIMBERLY BROCK, HARLAMPIJ ERMILOVICH DROZDOV",54
47,0.038834951456310676,"ANTHONY MARTINEZ, IND.CHELSEA ESCOBAR, CLARA LOZADA GÓMEZ, JAMES BRYANT, DANIEL POWERS, ERICA MILLER, AMANDA MCKENZIE, CHARLES KING, LUIS BARNES, IND.LAURA HOLLAND, ADAM DOYLE, DR.JONATHAN GILBERT, AGNÈS-JOSÉPHINE CROTEAU, CHRISTINE DROUIN, RENEE RAVI, SARA JOHNSTON, DR.DAVID LEE, ZHOU TING, ELAINE BREWER, DR.ERIC MYERS, ZHOU SHU ZHEN, ROLANDO HORACIO JUÁREZ MALAVE, MARY KING, DR. BARBARA GRIFFIN, ANA GONZALEZ, GU LI, BRANDON HOWARD, JEFFREY MURPHY, MICHAEL CAMERON, ANAÏS LAMONTAGNE, HEIDI ESCOBAR, BHAMINI KURUVILLA, ANGELA QUINN, VARDANIYA SONI, ALEXANDRA BOUCHER, STEPHEN BROWN, BOJAN JAKOVLEVICH SUVOROV, CLAUDIA LEE, GINA NGUYEN, DR.ANTHONY SNYDER, RAPHAËL LAPOINTE, PATRICK HOWARD, THOMAS SMITH, MICHAEL FISHER, MRS. JESSICA SIMMONS, GEORGES LANDRY, CAROLYN JACKSON, JAMES BRIGHT, CARL KING, MARY NGUYEN, MICHAEL SMITH, PURAB KAUL, LIU HUI, KAREN MITCHELL, BILLY PHILLIPS, DHANUK SHROFF, JAMES HILL, ROBERT FREDERICK, VINCENT PEREZ, RICHARD YODER, DIANA LANE, MISS LISA HARRIS PHD, CHRISTINA JONES, DAVID SNYDER, BRIAN HENDERSON, LAURENCE MOREAU-BOUCHARD, CYNTHIA HOWE, BENJAMIN MACDONALD, EDWARD RODRIGUEZ, NATHALIE-MICHELLE VILLENEUVE, JASON FIELDS, DARIUS HILL, ASHLEY SCOTT, LYNN MITCHELL DVM, REBECCA HANEY, TIMOTHY OSBORNE, JAYANT DANI, REGINALD RIVERA, ANTHONY PARKS, KELSEY WOLFE, DR.KRISH SANGHVI, LUC LAPIERRE, MONICA NELSON, RÉMY BÉGIN, MICHAEL ALLEN, KATHLEEN RUSSELL, TIFFANY BOWEN, LUKE SCHNEIDER, AMY RAMOS, ÉLISABETH LEMIRE, GABRIEL LEMIEUX, SAMANTHA SCOTT, LUYANDA MATHENJWA-MADONDO, PROHOROVA VIKTORIJA STEPANOVNA, ELA APTE, ELIZABETH TAYLOR, NICOLE DAVIS, HARRIET HARRISON, HEATHER POWERS, XU YAN, DR.CRYSTAL CHAPMAN, ALEXANDRA THOMAS, JAMES ALVAREZ",103
51,0.032679738562091505,"PAUL TRÉPANIER, TIMOTHÉE BOUDREAU, ÉLISABETH LACROIX, EVAN JENKINS, JIANG XU, GENG YING, TIFFANY GARCIA, ALISON JACKSON, MARILYN GUZMAN, JAMES HAWKINS, SUZANNE SAMPSON, GINA RUSH, DALE WALKER, CYNTHIA GREEN, JANICE RODRIGUEZ, MOVECARGO, ALEXANDER GREEN, TIMOTHY MORRIS, RENÉE DESROSIERS, COLETTE TURCOTTE-FILLION, MICHAEL LEWIS, REBECA CELIA ARROYO CABÁN, MEGAN KING, ROBERT SMITH, CHRISTOPHER FERGUSON, DEVIN AUSTIN, ROBERT MATA, ALEXANDRA KENNEDY, DR.MATTHEW DAVIS, SAMANTHA OWEN, ALEXANDRA DALLAIRE-SIMARD, JEREMY DAVIS, JOSHUA CARLSON, NIE HAI YAN, KYLE DRAKE, DHANUSH DAR, DR.BRYAN BROWN, MARK GONZALEZ, WANG XIU MEI, TARINI AGGARWAL, ANN SPENCER, JIMMY DOMINGUEZ, GARY VINCENT, COREY JACKSON, BRITTANY LIU, OLIVIA FLOWERS, ROBIN POWELL, ALEXANDRA BROWN, REBECCA ELLISON, CATHERINE LAVIGNE, NICOLE ST-ONGE-SÉGUIN, IND.ZHANG YING, RHONDA BROWN, DR.PETER WOLF, DR.MATTHEW CLARK, ALEXIS TERRY, LESLIE HARRIS, MICHELE HUGHES, TRISTAN CHARETTE-MARTIN, ANGELICA WILKINSON, JACOB STONE, STEPHEN LEWIS, JOE JOHNSON, DR.SAMANTHA JOHNSTON, AMANDA BAIRD, HRIDAAN KEER, DAVID MORGAN, IND.MICHAEL RICHARDSON, TRACEY ROGERS, MISS BRITTNEY FARMER DVM, MR. CHRISTOPHER BENNETT, KRISTEN DAVIS, DR.DAVID TAYLOR, DR.GORDEEV EVSEJ ZINOV'EVICH, KELSEY WATSON, DR.PURAB SWAMY, MEGAN DAY, JOANN ASHLEY, GERALD CASTANEDA, TIFFANY DAVIS, VAIBHAV MADAN, DR.CHRISTINE GAMBLE, LAKSHIT BATH, DR.ASHLEY WHEELER, ANDREW SMITH, GARRETT VEGA, HUANG DONG MEI, BOBBY JOHNSON, TIMOTHY BAKER-MILLS, DONALD MURPHY, FAN JIAN HUA, MICHAEL HUTCHINSON, GUILLERMINA TOMÁS NIÑO, ELAINE GRANT, ERIC PHAM, YANG FENG LAN, BHAVIN SAVANT, CASEY SMITH, CHARLES MARTIN, SARAH TURNER, PATRICIA DIAZ, SUSAN FREEMAN, DIANA FLOWERS, HAZEL DATTA, IND.ALEXIS DONALDSON, GREGORY TATE, SAMUEL PROVOST, MARK HALE, JAMES EDWARDS, ANNA TAYLOR, JESSICA BAILEY, CHRISTINE HERNANDEZ, DR.GABRIELLE-SARAH LACHAPELLE, MATHIEU BOULANGER, PAMELA FOSTER, LANGALIBALELE SHOZI, CHERYL GONZALES, ADVIK CHERIAN, ZAINA BATTA, MAKAYLA HART, ERIK CROSBY, DIANA PARKER, BRIAN LEE, AARAV MALL, JOSHUA AUSTIN, MARIE CHOUINARD, MICHAEL FLETCHER, DAVID COOLEY, TIMOTHY WALKER, NATHALIE FERLAND, JAKE MITCHELL, DR.VEER RAMACHANDRAN, DAWN JORDAN, DR.LAURENCE BEAULIEU, BRANDI TERRY, TONY JORDAN, MARK WILKINSON, YU HONG MEI, CHARLES GRIFFIN, DR.MEGAN KING, DR. ELIZABETH JONES, MIKAYLA TORRES, PATRICIA HUFFMAN, DR.FRÉDÉRIC MARCOTTE, HÉLÈNE-SIMONE LEBEL, MR. CHRISTOPHER REYES JR., SANDRA BIRD, JEFFREY HOPKINS, MICHAEL LEE, DR.PAULINA DEL RÍO GRIJALVA, NICHOLAS VAZQUEZ, DR.EDWARD FUENTES, THOMAS HICKS",153
88,0.0297029702970297,"MRS. GABRIELA BROWN, DR.JAMES FIGUEROA, MISS LORI GREER, SHARI THOMAS, ÉDOUARD VÉZINA, PATRICIA BAKER, MARIA WILLIAMS PHD, OLIVIA PEREZ, KRISTINA HANSON, JOSHUA BUSH, DR.MARIANO CHAPA, JENNIFER HORTON, HOLLY GOODWIN, MICHAEL PAGE, AIMEE BAKER, DR.STÉPHANIE HAMEL, DAWN ORTEGA, MEHUL MANE, PAULETTE BERGERON, JONATHAN PATEL, LYDIA ADAMS, DANA WELLS, THOMAS BOWEN, LIU JIA, EDWARD CONTRERAS, MICHEL HARVEY, IND.AMY YOUNG, CHARLOTTE BISSON, ASHLEE TERRELL, ROBERT SMITH, RÉMY THÉRIAULT, JOSEPH WARREN, SANDRA MCKINNEY, CRYSTAL GALLEGOS, BRIAN CASTRO, DR.CAROLINE RICHARDSON, CYNTHIA SMITH, DENNIS GUERRA, KEVIN MEYER, CHAD HERNANDEZ, MICHELLE ORTIZ, JOSHUA BELL, TAMARA TRAN, KELSEY REED, LACEY DEAN, IND.HARRY CALDWELL, DR.ELIZABETH KHAN, CUI XU, RANBIR RAMAN, G-ZHA DORONINA POLINA VJACHESLAVOVNA, JIVIKA BALAKRISHNAN, JESUS WARD, DR.STÉPHANE MÉNARD-DUFOUR, DR.BRIGITTE-SYLVIE LÉVESQUE, ROBERT SANCHEZ PHD, SAMUEL DESJARDINS, DR.KAYLA GORDON, JUSTIN ALLEN, SHAWN MONTGOMERY, DR.EVAN COMBS, MARCO HERNANDEZ, MICHAEL CLARK, LUCAS-NICOLAS GIGUÈRE, LIC. RAMÓN JARAMILLO, CURTIS ROWE, MANUEL JUAN ESPINO, ALEXANDER WATKINS, DR.CASEY THOMAS, QIN YANG, MATTHEW ANDREWS, DANIEL HOWARD, MAUREEN LOPEZ, NOËL JACQUES, JENNA WEST, LINDA AGUILAR, DR.THEODORE MORGAN, JOHN MILLER, RONALD HARVEY, DR.COURTNEY SINGH, GÉRARD-BERNARD DIONNE, ARTHUR LAVOIE, DR.BO XIANG, MARTIN ROBINSON, JESSICA BAKER, MICHELLE SMITH, JIANG PING, DR.RYAN KELLY, MATTHEW TURNER, IND.MARY FREEMAN, OMAR MARSH, DR.ARTHUR SAVARD, SHAWN HICKS, MAUREEN CASEY, ÉTIENNE RODRIGUE, BENJAMIN WRIGHT, MORGAN LYONS, DR. JOSÉ CARLOS ALEMÁN, DR.MICHEAL JONES, DR.ERICA HORTON, DR.IVAN MITCHELL, KRISTEN SHARP, JUSTIN RAMIREZ, SIMONE PELLETIER, SIMONE CHARBONNEAU, DULCE ESTELA VIERA, ALEXA JOHNSON, DAVID HAMMOND, RICHARD CASTILLO, HILARY MURRAY, WANG XIU ZHEN, MARY RAMIREZ, KRYLOVA FEVRONIJA SERGEEVNA, KYLIE NELSON, PAWCLINIC, DR.ROBERT PARRISH, NOÉMIE PRÉVOST-PÉPIN, STEPHANIE SHERMAN, DEMENTIJ EVSEEVICH MEL'NIKOV, SHANNON KELLER, ASHLEY DELEON, ZHOU WEN, ZHAO CHANG, MARISSA NGUYEN, WILLIAM EDWARDS, ÉDITH BOUCHER, MR. THOMAS WILSON, CHRIS GALLAGHER, DR.MIKE HARRIS, DOROTHÉE CHARRON, JENNIFER SMITH, ALBERT HENRY, CRAIG AGUIRRE, AGNÈS PATEL, PAUL ROBERT, JENNIFER CAMPBELL, BRANDON MARSHALL, APRIL WILLIAMS, DR.LAURA HUFFMAN, JOANN BERRY, DANIEL KENNEDY, EDDIE BELL, JACOB IBARRA, EDWIN DAVIS DDS, MELISSA HALL, ROBERT DAVIDSON, DIANA MORRIS, DR.WANDA JOHNSON, MEGAN MORGAN, MIGUEL DAVIS, ALLISON KRAUSE, MICHAEL ALLEN, SARA LYNCH, DEBORAH KAUFMAN, MICHAEL WOOD, MELANIE LOPEZ, JOSEPH WAGNER, ZHANG MEI, NOÉMIE-GENEVIÈVE LEMIRE, NICOLAS VILLENEUVE, BILLY RICE, MINDY COWAN, PAOLA JULIO ALCARAZ MENA, OLIVIER SAVOIE, MAHIKA VOHRA, NICHOLAS CAIN, ZAIN KANT, KAITLIN FISHER, STEPHANIE SPARKS, JENNIFER HARRIS, JAMES THOMAS, CASSIE WASHINGTON, JEFFREY ROGERS, JENNIFER VALDEZ, LAUREN LE, THOMAS OBRIEN, ANNE DANIEL, JAMES DOUGLAS, TANG JIAN GUO, THOMAS STEWART, ZHANG LONG, KAREN HOWE, CAO GUI XIANG, JOHN RAMOS, CHRISTINE BRANCH, JONATHAN FRANKLIN, JONATHAN GAUTHIER, ZHANG CHEN, MICHAEL SALINAS, DR.ASHLEY GORDON, SHANE BAKER, WESLEY HAYNES, MARCELLE GAUDREAULT, WILLIAM CHAPMAN, FLORENCE LAUZON-GILBERT, ROBIN WALKER, ANTHONY MOLINA, RICHARD DEAN, BEVERLY FLOWERS, RENEE SHENOY, ANITA MARTIN, YANG XIU LAN, GUY-ÉTIENNE PERREAULT",202
42,0.026490066225165563,"DR.JOSHUA WHITAKER, CRYSTAL NEWMAN, SANDRA FOSTER, KEVIN BOLDUC, MRS. AMANDA HOWELL, MARC PARENT, PAMELA ORTIZ, JONATHAN DAVIS, AMANDA COLE, THOMAS RAMIREZ V, SHRAY VOHRA, RANDY MCKEE, KEVIN WALLS, ANTHONY LARSEN, DOROTHÉE POULIOT, AMANDA WALLACE, MARGOT HÉBERT-GIRARD, TROY CANTU, GAO XIA, DR.CHRISTINA BISHOP, DR.LAURENCE TESSIER, TIMOTHY CONTRERAS, RYAN DUTT, ANITA STONE, MICHELLE HENRY MD, MARY WILLIAMS, DR.PIERRE PATEL, CESAR ROBERSON, SARA JACKSON, EDUARDO CALHOUN, LIANG YU ZHEN, STEPHANIE BRADFORD, DR.SARAH GUTIERREZ, JAMES RILEY, DERRICK SHAFFER, GABRIELLE GENDRON, YAKSHIT GOPAL, PAMELA JONES, VICKIE ADAMS, ALEX MARSHALL, MARY DUNN, ROBERT MOSS, HU LEI, DAVID REED, TAMMIE EWING, TIMOTHY HAYDEN, DAWN COLE, CLÉMENCE ASSELIN, CÉLINA LABONTÉ, HOWARD BRYAN, DOROFEEVA ANZHELA VIKTOROVNA, JUSTIN HERNANDEZ, TIMOTHY LE, DR.RAPHAËL SIROIS, ANNE FULLER, HERR ARTHUR POHL, KAYLA BELL, MO NA, DR.THERESA BUTLER, CONNOR SANCHEZ, DR.LIU SHUAI, ZHOU TING, THOMAS BROWN, DAISY SMITH, MATTHEW MILLER, THOMAS BUCHANAN, JESSICA MURRAY, ZHAO HONG MEI, JUDY WILLIAMS, JONATHAN BROWN, CLÉMENCE LABELLE, ROBIN WHITE, HUGUES RODRIGUE, ERIC FRANKLIN, ERIC GREENE, JUSTIN PORTER, NATHAN TROTTIER, BRIAN DECKER, DR.TAN QIAN, ZHU XIU FANG, JEFFERY ADAMS, DR.TODD DAVIS, CHRISTINE CLARK, DR.JEFFREY BENNETT, NICOLE BRUNET, CAITLIN BARRETT, MANJARI TAILOR, ANTHONY TURNER, MATTHEW WELLS, CHARLES PACHECO, WILLIAM LAMBERT, SHELLY MORTON, HENRI MARTEL, KELLY BOWERS, JACOB BEST, TRACEY ONEILL, EXPRESSDRIVE, EDWARD GARCIA, BRYAN GALVAN, SANTIAGO BARBARA SAIZ ARREDONDO, IND.NATHALIE-ÉLÉONORE VALLÉE, DR.ELIZABETH ROY, RENÉ BRETON-BOUDREAU, CHARLOTTE TURNER, MÉLANIE-GABRIELLE LAMOUREUX, MATTHEW SANTIAGO, LISA DAVIS, TIMOFEEV NESTOR JUL'EVICH, DR.TIMOTHÉE MORISSETTE, CHRISTOPHER LEBLANC, DRISHYA CHOKSHI, VEDIKA DUGAR, JEFFREY KING, WANG NAN, LAUREN HENRY, TROY HERNANDEZ, WILLIE FISCHER, DR.KAITLIN CASTILLO, VINCENT LUNA, KEITH RAMIREZ, ANA JOHNSON, THERESA WILKINSON, CHRISTOPHER MCGEE, CRYSTAL ACOSTA, ARTHUR BAUER, DR.AMY CLAY, NATHAN HEBERT, DANA JONES, MARY WILLIAMS, ISAAC PERKINS, CAROLINE MAXWELL, CHARLES PROVOST, THOMAS VEILLEUX, DR.LIU JIA, SOPHIE-JOSÉPHINE BEAUDRY, LYNNE JARVIS-STEPHENSON, DANIEL STEELE, TRAVIS BYRD, ALEXIS LÉVESQUE, YVES-ZACHARIE PARÉ, DIANE ROJAS, ROBERT BRYANT, BERNARD GERVAIS, PETER MCKINNEY, GABRIEL PROVENCHER, LUIS WILLIAMS, HAO SHU HUA, STEPHANIE CHAMBERS MD, LAGAN DESAI, HEIDI PATRICK, KEVIN CUNNINGHAM MD",151
78,0.024390243902439025,"ZACHARY CHAVEZ, DAKOTA HANSEN, KIM BROWN, MATTHEW ROLLINS, ANTHONY DAVIES, IND.YANG BO, BEVERLY WILSON, STEPHEN STONE, JULIE CUNNINGHAM, ANNA BOONE, LARISA TIMUROVNA KRASIL'NIKOVA, BRIAN EDWARDS, ERIK WILLIAMS, DAVID CAMPBELL, DR.OLIVIER PRÉVOST-DESJARDINS, JOSHUA GONZALES, ALEXIS ANDERSON, TAN HAI YAN, DR. MARIA GREEN, DR.PARI DYAL, PATRICK CRAIG, CÉLINE LEPAGE, BERTRAND-TIMOTHÉE LANGLOIS, LUCIE PARADIS, RACHAEL ROBINSON, IND. NICHOLAS FISHER, LINDSEY PALMER, TERRY THOMAS, ROGER FERLAND, ANDREW COBB, TERESA MORENO, RICK BOOKER, DEREK ELLISON, JUAN GILL, DR.CHARLES FISCHER, ANAY LAD, AMANDA BROOKS, ALLISON FRANCO, ALICE DAVIS, KRISTEN DUNCAN, PAULA WARREN, LAURENCE LAPLANTE, JULIE CARR, TRACEY SMITH, WANG HONG, ROBERT BROWN, LUIS STRICKLAND, DR.RACHAEL HUBBARD, VALERIE PRUITT, ASHLEY REED, DOUGLAS GONZALEZ, KYLE KIM, DR.SETH CORDOVA, ELAKSHI MANGAL, UTHKARSH GANESH, FELICIA SALAZAR, ASHLEY BARNES, BOBBY HARRIS, REBECCA HUGHES, AMANDA THOMAS, JON REYES, JENNIFER HANEY PHD, ROBERT HO, ZHOU XIA, SHERRI GLENN, AYESHA DEVI, KENNETH COPELAND, NIKANOR HARLAMPOVICH KALININ, DR.EDWARD STEPHENS, KRISTIN VARGAS, STACEY HUNTER, ANTHONY THOMPSON, PAULA BOOKER, FORTUNAT USTINOVICH MASLOV, DR.MATTHEW MCCORMICK, ALEXANDER ANDERSON, KATHERINE AYALA, JEFFREY WARD, MONIQUE THOMAS, PATRICK PHAM, RUSSELL DELGADO, ZHU YUN",82
45,0.023923444976076555,"YANG NAN, JOSHUA WATSON, DR. LAWRENCE MARTINEZ, TASHA SMITH, RODNEY FLOWERS, CAMILLE TESSIER, ELIZABETH BAUER, CHASE RICHARDSON, BRIANA ROBINSON, JIVIN BALA, MR. RYAN DAVIDSON, MICHAEL YODER, MILAN DIMITRIEVICH MIHEEV, IND.VRITIKA SACHDEVA, YUVAAN HALDER, HENRIETTE-ÉLISABETH DUFOUR, MARCELLE JEAN, JIANG CHAO, DR.ERMIL GLEBOVICH SITNIKOV, CHEN GUI FANG, TIMOTHÉE TREMBLAY, AMY LINDSEY, FRANK BULLOCK, IND.ADIRA SULE, MARCELLE LAMONTAGNE, OJAS DEOL, ROBERT FISCHER, BENJAMIN SULLIVAN, CHARLES SHIELDS, LOUIS ANDERSON, VALERIE GREEN, STEPHEN NELSON, ALEX GONZALEZ, DR.RÉMY GUAY, ZOÉ FORGET, AZAD BAHL, DAVID BOWERS, SAMIHA KARI, EDWARD FLORES, MARTIN DUVAL, RÉMY BOILY-DUBÉ, REBECCA HUNTER, PAUL ALLEN, DR.MICHAEL PATEL, SHANAYA SACHDEV, ANDRE MIDDLETON, JUDITH SMITH, JAMES WALTERS, JACQUELINE MARTIN, SHANE SALINAS, COURTNEY GREENE, SEAN RICHMOND, DANIEL POTTER, LORI FAULKNER, ALEXANDRA VÉZINA, WANG YUN, TERRI SIMMONS, STACEY SMITH, MRS. MELANIE BRYANT, CODY RAMSEY, JOSE ANDERSON, JESSICA BURKE, FREDERICK CABRERA, AMY HAMPTON, TIMOTHY CARTER, CAITLYN HOLMES, DR.ALEXIS VASQUEZ, ROBERT HOWARD, DR.GERALD LEONARD, KIMBERLY BEST, LOU YU MEI, DIANA LAWRENCE, SUSAN GARCIA, LORI STONE, MARY OLIVER, MEAGAN HAMILTON, JÉRÔME FORGET, BECKY WEST, NANCY WILSON, MALLORY WHITE, DR.JOSETTE LACHANCE, DOMINIQUE HOWARD, LOUIS AUDET, MATTHEW RIVERA, RODOLFO LEONOR ADAME CHACÓN, ROGER PETERSON, DR.RONALD LOPEZ, JEFFERY MURPHY, DR.FERNANDO FLORENCIA BADILLO, YUVRAJ  KURUVILLA, DR.CHRISTINE MURPHY, CHARLOTTE LABONTÉ, GABRIELLE ROSALES DDS, DR.MARTINE CHAREST, RENEE FISHER, UTHKARSH RATTAN, DR.LISA MILLER, MICHELLE WATSON, VERONIKA BORISOVNA FEDOTOVA, DR.MARYSE-JULIE RIVARD, UTHKARSH MANI, DHANUSH GADE, RAPHAËL LANGLOIS, JOSEPH MORRISON, CARLA BYRD, MARTIN LOPEZ, DIANA PERRY, ZHUANG YU, BROOKE OBRIEN, JASON MCINTOSH, CARLOS THOMAS, RYAN AUSTIN, KIMBERLY BEST, EVAN BROCK, DR.RACHEL HOUSTON, EDWARD HOOVER, OL'GA FELIKSOVNA JUDINA, RICHARD SPEARS, AMBER PARKS, DR.CHRISTOPHER EVANS, MICHAEL SMITH, AARNA BEN, DIVIT BEDI, DANIEL JACKSON, KIMBERLY SHEPHERD, KYLE BAKER, SHELIA PAGE, MATTHEW CHAVEZ JR., LUCAS BÉGIN, ROGER BROWN, WILLIE LAMBERT, BLANCA ESCALANTE, LESLIE DAVIS, CRAIG MOORE, NITYA BOBAL, ANTOINE ST-LAURENT, JOSHUA GRAHAM, DR.BRIDGET SANTANA, MA JUN, SANDRA COOK, JONATHAN STOKES, PHILIPPE LABONTÉ, JORGE BUCHANAN, NAVYA BADAMI, ZHOU LI, DR.MARK BELL, DR.JULIE KIM, MATTHEW HERRING, CHRISTIAN CLAY, BARBARA LARSON, ALIA BHARGAVA, TERRY FRAZIER, KATIE PENA, BAI JIN FENG, ANGELA OLSON, KANAV DOCTOR, WAN CHENG, LINDSEY FIGUEROA, MATHIEU BÉLAND, THERESA SCHMIDT, KRISTA MILLER, DR.JOE GOMEZ, MARCELLE RIVARD-DEMERS, ÉMILIE LABELLE, COLIN HARRIS, VICTOR ARCHAMBAULT, LAURENT GAGNÉ, PATRICIA ALLEN, JOSEPH ESTRADA, MITCHELL STANLEY, OCÉANE LAMBERT, ELIZABETH KELLY, CAI QIANG, ERIC CASTILLO, DR.MICHAEL SHIELDS, ALYSSA LEWIS, PHILIPPE-GUY RAYMOND, JASON OLIVER, MOLLY HAYS, DORONIN DOBROSLAV JAROSLAVOVICH, DR.JOSÉ MANUÉL LONGORIA CONTRERAS, KAREN PEREZ, FRANK DAVIS, ANGEL PEREZ, ROBERT SÉGUIN, JAMES REED, ALAIN BÉLANGER, JORDAN FLOWERS, DEBRA GEORGE, HEATHER DELEON, IND.PAUL SCHULTZ, MATTHEW COOPER, CATHERINE REYNOLDS, DR.ELLEN SMITH, DOROTHY VARGAS, KELLIE JENKINS, TUROVA LJUDMILA PAVLOVNA, LORRAINE SCHULTZ, IND.TIFFANY JORDAN, FEVRONIJA ZAHAROVNA LARIONOVA, SHA XU, VINCENT CLAY, LEONEL ELIAS LEDESMA, JENNIFER WILLIAMS, VAIBHAV BHAGAT, THOMAS LIN, LOUIS CORTEZ, KEVIN LOPEZ, ANNETTE RAMOS",209
22,0.023255813953488372,"ROBERT HUGHES, CENG RUI, DUSTIN MARTINEZ, JOSHUA ELLIS, MARTINE LAPLANTE-CLOUTIER, THOMAS PALMER, FRÉDÉRIQUE LACROIX, LOUIS HARVEY, LOBANOVA VERONIKA ARHIPOVNA, STEVEN ALEXANDER, DR.NATHALIE DUMAS, TUSHAR BORAH, DR.MICHELLE WELLS, CHRISTOPHER HERRING, COLLIN ZAVALA, JOSE DAVIS, CHARLES STANTON, DAWN HAMILTON, DR.RITVIK ARYA, JI TING, JACOB ONEAL, YVES GILBERT-SIMARD, KRISTIN ANDERSON, AMANDA WILLIAMS, FAN ZHI QIANG, DR. MELISSA BLEVINS, CHIRAG KALITA, MARTIN BROWN, JOHN ROBINSON, NICOLAS NGUYEN, BRADLEY GREGORY, JOHN PARKER, IND.MÓNICA GODÍNEZ BARRETO, SEAN REED, FRIDA GUTIÉRREZ, MARY JACKSON, DR.SHEILA POWERS, JAMIE DAVIS, DR.RANDY EDWARDS, DR.ABEL ROSALIA ARMENTA HIDALGO, PATRICIA DIAZ, GREGORY OLIVER, DR.WU HAI YAN, DEBORAH ROMERO, IND.WEI YUN, ALISHA BEHL, JAMES FOX, LAURA BROWN, JENNIFER SCHMIDT, MANIKYA MALHOTRA, APRIL HALL, SOPHIA VASQUEZ, ERNEST GOMEZ, AMANDA MENDOZA, JUSTIN BARKER, BRANDON MURPHY, IND.PAUL MILLER, DR.CATHY MANNING, CAROLINE REYNOLDS, KAREN RICE, YANG JIAN, SHANNON RICHARDSON MD, TRISTAN-PHILIPPE FORTIER, DR.DR. ADAM JONES DDS, MICHAEL WEAVER, COURTNEY STEPHENS, OLGA ELVIA FELICIANO, MRS. EMMA FRENCH, PATRICIA WHITE, HÉLÈNE LABONTÉ, MELISSA MCBRIDE, SARAH BOLDUC, PHILIPPE SAVARD, DR.RONALD MILLER, JOSE DEAN, KIMBERLY ROY, SHARON RODRIGUEZ, SOPHIE MERCIER, DR.LV NING, KRISTINA COLE, MARIA PERRY, CÉCILE PERRON, DR.HEATHER PHILLIPS, MARTIN AGUILAR, REN FANG, DR.JUAN BROWN",86
48,0.023076923076923078,"ROBERT THOMAS, EVAN JOHNSON, KATELYN GIBSON, WILLIAM BAKER, WILLIAM CROSBY, AMY CORDOVA, LISA MOORE, GABRIELLE BLAKE, JASON LEWIS, KIAAN RAMAKRISHNAN, MRS. KELLY HOWELL DDS, JOSE MILLER, CONSTANCE FORGET, MARY ADAMS, MÉLANIE DUBÉ, DR.DARSHIT SAWHNEY, JAMES PARRISH, ALEX VAILLANCOURT-LEMIRE, STEPHANIE HENSLEY, MRS. JENNIFER GONZALEZ, TONI SCHMITT DDS, NATHAN SHERMAN, TIMOTHY SIMMONS, HEATHER JOHNS, REBECCA MOORE, MICHELLE BRISSON-LAPIERRE, DENIS MARCOTTE, JOSHUA HOLLOWAY, RACHEL GRIFFIN, THERESA CAMPBELL, ANNA WALLACE, JOHN STEWART, ERICA LOPEZ MD, DOROTHY MCLEAN, EMILY DALTON, CHELSEA BRAY, CHRISTINE HARRISON, ROBERT TORRES, SAMANTHA BROOKS, DR.KELLY COMBS, DR.JOHN WADE, VICTOR MARTINEZ, LAURA NEAL, TIMOTHY FOLEY, BRIAN CALDWELL, REBECCA SMITH, PIERRE MARCOTTE, KAYLA WILSON, JOSEPH HERNANDEZ, MELISSA BUCHANAN, SCOTT JONES, SARA JOHNSON, MELISSA REESE, DR.SHARON HUFF, SHANNON MONTES, MICHAEL RICHARDS, COURTNEY MOORE, DERRICK REYES, DR.PAUL NORTON, ÉDOUARD DUBÉ, CHRISTINA MAYS, JOHN MILLER, JACOB ANDERSON, LAWRENCE HALL, DOUGLAS LLOYD, JENNIFER CLARK, BRIAN CASE, TRACY WALLACE, KEVIN NUNEZ, ROBERT SCOTT, DR.EMMANUELLE CHABOT, AMBER BOWMAN, WILLIAM RODRIGUEZ, TERRENCE PARKER, AMY SMITH, LIU LIU, JOSE MIDDLETON, DR.EMMANUEL LABELLE, JOSHUA GRAHAM, JILL MCKAY, LI XUE, AMANDA BELL, DAVID STEPHENS, MARC ADAMS, SOPHIE PICARD-RIVARD, MICHELE MERCADO, STEPHANIE KIM, NATALIE HALL, HANNAH LEE, MARIE BEAUREGARD, BRIAN RANDOLPH, ANTHONY GIBSON, JOSHUA NELSON, DOUGLAS DOUGLAS, CÉLINA NOËL, DR.KATHRYN MILLER, DANIEL PARK, KNJAZEV ADRIAN EVSEEVICH, EMILY WARNER, OLIVIER DOUCET, STEPHANIE ROBINSON, TAYLOR MAYS, WILLIAM TAYLOR, STEPHEN ANDERSON, SAMUEL POWELL, KIMBERLY SANDOVAL, MR. DEREK ELLIOTT, DR. GERÓNIMO JURADO, IAN PEREZ, JOSEPH BAUER, VIRGINIE TRUDEL-ROUSSEAU, ANA MEYER, DR.JENNIFER MILLER, IND.MICHAEL COOK, ROBERT SIMPSON, CYNTHIA PERKINS, MA LONG, IRA SANDAL, MARTHA KING, ZACHARIE GRENIER, ALLISON BAKER, AUDREY BRASSARD, RACHEL THOMAS, JESUS JACKSON, MARIA FARRELL, CAITLIN JONES, SCOTT BUCHANAN, PENG XIU RONG, KRISTI CARDENAS, DR.HENRIETTE DROUIN",130
90,0.022727272727272728,"LAUREN PHILLIPS, JULIEN LEMIRE, JAMES POTTS, GILBERT ST-JEAN, TRISTAN FOURNIER-GOULET, JIM COX, ÉLÉONORE THIBAULT-DROUIN, ERICA FUENTES, JON HART, CHELSEA HALL, JACOB MERRITT, MARGARET GINGRAS, JENNIFER SHAW, APRIL JONES JR., PAMELA PHILLIPS, DANIEL CHARLES, THEODORE MITCHELL, HENRY VAUGHN, DR.MÓNICA GALARZA, VANESSA JONES, DIANA HUGHES, HEATHER PARSONS, DR.MRS. AMANDA WATTS, CARLOS RAMIREZ, TONY MOORE, KURT MOON, ANNE BOILY, CHRISTOPHER MCCOY, MARK KING, JIVIKA ACHARYA, ALEXANDRA DESROSIERS, JEFFREY DAY, FRANCISCO GONZALES, DAVID HOWELL, ASHLEY HUNTER, ANGELA MCINTYRE, LAETITIA COUTURE, DR.MARTINE-ROSALIE POTVIN, GILBERTO HINOJOSA HURTADO, KAITLYN TAYLOR, VAIBHAV MADAN, ANGELICA RUSSELL, IND.STEPHANIE PETERSON, AMBER JOHNSON",44
57,0.021739130434782608,"DANIELLE GOMEZ, STEVEN LEACH, DR.ALEXANDER PATEL, JESUS PHILLIPS, KELLY ESTRADA, ALEXANDER CHAMBERS, LI PING, DIVIJ SAMPATH, FLORENCE LEDUC, LI LI, KELLY LANE, DR.MALIK RODRIGUEZ, KATHERINE HUTCHINSON, ALLISON REED, EMMANUEL-SAMUEL CROTEAU, VLADIMIROV DEMID EFREMOVICH, CHARLES PRICE, MATTHEW VALENZUELA, APRIL LUCAS, GUO FENG, JOSÉ LUIS ANTONIA PACHECO, DR.SPENCER JACKSON, DAVID ROBINSON, DR.TAMMY MARTIN, DORIS WALLACE, DAVID GOMEZ, HEATHER MARTIN, ZHOU LI LI, DR.ISHAAN SATHE, ALEXIS DURAND, AMBER HANNA, JEANNINE-SOPHIE BOISVERT, AUDREY DAIGLE, DANIELLE THOMPSON, JESSICA THOMAS, RACHAEL GAY, TODD HUGHES, KATIE HOFFMAN, BROOKE HILL, CENG HUI, JUSTIN KIM, SANDRA KING, KATHLEEN KNAPP, RICHARD JOHNSON, ROLAND BÉGIN, BRITTANY KING",46
3,0.02097902097902098,"DR.CLAIRE-ZOÉ BÉGIN, DR.STEPHANIE FRANKLIN, DR.LAURENCE LALONDE-LAROSE, COURTNEY OLSON, ZHAO PING, CHEYENNE DAVIS, JANICE MOORE, THOMAS JONES, JOSETTE THIBODEAU, KIMBERLY CABRERA, PÉNÉLOPE CHARRON, JENNIFER ADAMS, KAYLA STONE, BRENT AYALA, DR.TARAN BALASUBRAMANIAN, GLORIA WHITE, STEPHANIE MOORE, TRACY SMITH, ZHU NA, LIANG QIAN, AGAF'JA ANATOL'EVNA SUBBOTINA, FREIGHTDRIVE, NICHOLAS JONES, JASON MACIAS, DENISE MCCALL, NICOLAS TURGEON, ÉLODIE DESCHÊNES, TRICIA ORTIZ, BLAKE ARMSTRONG, MEDVEDEV NIKITA DOROFEEVICH, PAUL CHARETTE, JOSEPH MYERS, ANTHONY STOKES, BRIAN SHAW, MICHAEL COLLINS, LI MEI, THOMAS DUMAS, LESLIE WALKER, SAMUEL MOORE, ASHLEY RUSSELL, KATHLEEN SANCHEZ, DAVID REID, FENG XIANG, CHRISTINE WALKER, HECTOR CARR, SHAWN STONE, DR.CHRISTOPHER LIN, ANVI DOCTOR, DONALD FORBES, DR.TOV. KABANOV ERMIL ANTONOVICH, ANDREW JONES, SHI YING, LAURIE WILLIAMS, CHARVI BUCH, DR.JESSICA NGUYEN DDS, MICHAEL YOUNG, LINDSAY JOHNSON MD, KENNETH LEE, ERICA MCFARLAND, VANESSA FONTAINE, ALEXANDER OCONNOR, STEPHANIE SMITH, DENISE CONRAD, FAN DAN DAN, HUNAR KEER, ANDREA CAMPBELL, EMILIANO GREGORIO QUIÑONES ESCOBAR, JOHN PRUITT, WILLIAM WARD, HANSH KOHLI, LINDSEY LOWE, JOSEPH CARPENTER, CRYSTAL SMITH, LI YAN, STEPHEN THOMAS, TRACY WHITNEY, MICHELE BOOKER, KEVIN WHITE, PENG YING, JOSEPH DUNN, KYLE DAVIS, IND.DONALD PROCTOR, RICHARD MORSE, DING JIAN PING, SHIRLEY SINGLETON, FRANCISCO SAMANIEGO ORTIZ, XIAN WEI, ANTHONY THOMAS, DYLAN GUZMAN, EMILY LANG, JOHN MILLER, CHRISTINA LAMB, AUSTIN JENKINS, DR.MR. NATHAN PEREZ JR., MARCEL BERTRAND, ROBERT EVANS, ROBERT KELLY, DIYA BAWA, HEIDI ARMSTRONG MD, DR.CHEN FAN, DAN NEWTON, DR.MARTINE-ANNE ROUSSEAU, ALEXANDER SCHULTZ, HIMMAT YADAV, LAURENCE VEILLEUX, DAVID WILKERSON, MARIA MARTIN, SARA DHINGRA, THÉRÈSE GÉLINAS, KAYLA SHEPPARD, MATTHEW PRESTON, JENNIFER FULLER, DEBRA BOWERS, CHRISTOPHER NICHOLSON, BÉATRICE SÉGUIN, SYDNEY DOUGLAS, SHAWNA HANSON, TAMMY BURKE, PEDRO BARBER, DANNY HORN, DEBRA CLARK, DANIEL WILLIAMS, JONATHAN HERNANDEZ, HIMMAT SALVI, STÉPHANE HOULE, KEVIN SEXTON, JASMINE VEGA, RICHARD RODRIGUEZ, ZOJA EDUARDOVNA VLADIMIROVA, TONYA FARMER, JILL MCDONALD, GABRIEL PATEL, DR.KATELYN YOUNG, NOËL LAFLAMME, RENÉE BOISVERT, BRIAN RICE, CHRISTOPHER SCHULTZ, CHRISTOPHER GOMEZ, SHAAN TOOR, OSCAR ALVARADO, YANG XIU RONG, DR.FRANÇOISE HÉBERT, DR.WILLIAM RUIZ",143
91,0.02,"IAN PARKER, DANA LEONARD, AARON MACIAS, HU GUI YING, DONALD BAKER, DUSTIN HALL, YANG YUN, ANGELA DAVIS, DR.LAUREN PRICE, JONATHAN HENRY, SHANNON WRIGHT, CRISTIAN RIVERA, JONATHAN BROWN, MICHEL-ANDRÉ ROBITAILLE, CALVIN BROWN, MAO JIE, AMBER YOUNG, JOHN DUNN DVM, DR.CYNTHIA WALKER, VIRGINIE DALLAIRE, NICHOLAS JOHNSON, CORINNE MISICHER, RYAN REID, CODY CANNON, LISA BURCH, KYLE CARTER, JESSICA DIAZ, THÉRÈSE-ODETTE LACASSE, PAUL STANLEY, KEVIN RODRIGUEZ, HENRY BARNES, AMANDA GALVAN, KANAV DASS, BRENDA TAYLOR, IND.DANIEL HARPER, THOMAS SMITH, LOGAN SANCHEZ, DR.AARON ACEVEDO, DR.TAN YU, JACOB MEDINA, ISAIAH DOWNS, SUSAN MARTIN, RENÉ BLANCHETTE, GREG BURNS, MONICA BRADY, LEE BUSH, DIANE ROMERO, DULCE MARÍA JUAN PEREA URÍAS, NATHAN CARON, ZHANG SHU YING",50
107,0.018867924528301886,"MICHAEL DICKSON, KAYLA RAY, DANIEL ZIMMERMAN, RICHARD MONTGOMERY, DANIEL CLARK, EVA CHANA, CARRIE THOMPSON, PAUL MORALES, AUSTIN RAMOS, JULIE PEREZ, MICHELLE ANDERSON, ASTRID VEILLEUX, JOSHUA SCOTT, LISA FORD, HORTENSE GIROUX, CHRISTINE BLAIR, SARAH BAILEY, RODNEY LEE, ERIC SAUNDERS, LINDA MORRIS, ANNA SPENCE, SIMONE RENAUD, DEBBIE BIRD, DR.KARPOV SVJATOSLAV ISIDOROVICH, LISA HENDERSON, GUAN SHU LAN, STACEY REYES, JULIEN LABONTÉ, JAMES JACOBSON, NATALIE SMITH, TYLER MARSHALL, SIYA LAD, ANTONIO ARMSTRONG, HRISHITA RANGANATHAN, ISABELLE LESSARD, AMANI JAYARAMAN, MONICA PENNINGTON, YUVRAJ  SHERE, MICHAEL COOK, DR.MONICA HILL, CILLY KREBS, DR. BRADLEY BUTLER, ROY GLENN, DR.AMANDA WILLIAMS MD, LORI HARRIS, PHYLLIS CHAVEZ, LI XIU YUN, BRIAN FOX, DAVID LOPEZ, JOSEPH MOYER, BROOKE CONWAY, JAMES DAVIS, LATOYA GRAHAM",53
